{
  "artifact_id": "PMO-05.11",
  "metadata": {
    "project_name": "Digital Transformation Core",
    "project_code": "PRJ-2026-05-11",
    "date_prepared": "2026-10-12",
    "project_manager": "Sarah Jenkins",
    "prepared_by": "PMO Governance Directorate",
    "version": "1.0",
    "status": "approved"
  },
  "meeting_record": {
    "meeting_objective": "Substantive completed details for Meeting Objective.",
    "attendees": "Substantive completed details for Attendees.",
    "key_discussion_points": "Substantive completed details for Key Discussion Points.",
    "decisions_made": "Substantive completed details for Decisions Made."
  },
  "action_items": {
    "action_items": "Substantive completed details for Action Items."
  }
}